,question,chunks
92,,"Page 3 of 4 
Minn. Stat. § 16E.03  
 Trayce Hockstad   (1)  an accounting of each state agency’s expenditures for cloud computing initiatives and 
software as service solutions; and  
(2)  cost projections, timelines, and the names of any cloud provider selected for current 
computing projects that incorporate cloud computing solutions, and percentage of total 
cloud u se. 
(b)  This subdivision expires December 31, 2027.  
Subd. 6.  System development methods. —  The chief information officer shall establish and, as 
necessary, update and modify methods for developing information and communications systems 
appropriate to th e specific needs of individual state agencies. The development methods shall be 
used to define the design, programming, and implementation of systems.  
Subd. 7.  Cyber security systems. —  In consultation with the attorney general and appropriate 
agency hea ds, the chief information officer shall develop cyber security policies, guidelines, and 
standards, and shall install and administer state data security systems on the state’s computer 
facilities consistent with these policies, guidelines, standards, and s tate law to ensure the integrity 
of computer -based and other data and to ensure applicable limitations on access to data, consistent 
with the public’s right to know as defined in chapter 13. The chief information officer is 
responsible for overall security  of state agency networks connected to the Internet. Each 
department or agency head is responsible for the security of the department’s or agency’s data 
within the guidelines of established enterprise policy.  
Subd. 8.  [Repealed, 2014 c 271 art 4 s 7]  
Subd . 9.  Accessibility standards.   
(a)  The chief information officer shall develop accessibility standards applicable to 
technology, software, and hardware procurement, with the exception of infrastructure 
hardware. The standards shall not impose an undue b urden on the state.  
(b)  The chief information officer shall require state agencies to adhere to the standards 
developed under this subdivision unless an exception is approved pursuant to subdivision 10. 
Except as provided in paragraph (c), the standards d eveloped under this section must 
incorporate section 508 of the Rehabilitation Act, United States Code, title 29, section 794d, as 
amended by the Workforce Investment Act of 1998, Public Law 105 -220, August 7, 1998, and 
the Web Content Accessibility Guidel ines, 2.0. The chief information officer must review 
subsequent revisions to section 508 of the Rehabilitation Act and to the Web Content 
Accessibility Guidelines and may incorporate the revisions in the accessibility standards.  
(c)  If the chief informati on officer, in consultation with the advisory committee established 
under Laws 2009, chapter 131, section 12, determines that any standard developed under this 
subdivision poses an undue burden to the state, the chief information officer may modify the 
burdensome standard, provided written findings and rationale are made explaining the 
deviation.  
Subd. 10.  Exceptions to accessibility standards. —  Exceptions to the standards may be granted 
by the chief information officer based upon a request by an agency made in accordance with the 
thresholds and process established under Laws 2009, chapter 131, section 12, subdivision 2."
93,,"Page 2 of 4 
S.D. Codified Laws § 1 -27-1.5 
   with any public employee and any related document that specifies the consideration to be paid 
to the employee;  
(8)  Information pertaining to the protection of public or private property and any person on or 
within public or private property including:  
(a)  Any vulnerability assessment or response plan intended to prevent or mitigate criminal 
acts; 
(b)  Emergency management or response;  
(c)  Public safety information that would create a substantial likelihood of e ndangering 
public safety or property, if disclosed;  
(d)  Cyber security plans, computer or communications network schema, passwords, or 
user identification names;  
(e)  Guard schedules;  
(f)  Lock combinations; and  
(g)  Any blueprint, building plan, or infra structure record regarding any building or facility 
that would expose or create vulnerability through disclosure of the location, configuration, 
or security of critical systems of the building or facility;  
(9)  The security standards, procedures, policies,  plans, specifications, diagrams, access lists, 
and other security -related records of the Gaming Commission and those persons or entities 
with which the commission has entered into contractual relationships. Nothing in this 
subdivision allows the commissio n to withhold from the public any information relating to 
amounts paid persons or entities with which the commission has entered into contractual 
relationships, amounts of prizes paid, the name of the prize winner, and the municipality, or 
county where the  prize winner resides;  
(10)  Personally identified private citizen account payment information, credit information on 
others supplied in confidence, and customer lists;  
(11)  Records or portions of records kept by a publicly funded library which, when exam ined 
with or without other records, reveal the identity of any library patron using the library’s 
materials or services;  
(12)  Correspondence, memoranda, calendars or logs of appointments, working papers, and 
records of telephone calls of public officials or employees;  
(13)  Records or portions of records kept by public bodies which would reveal the location, 
character, or ownership of any known archaeological, historical, or paleontological site in 
South Dakota if necessary to protect the site from a reaso nably held fear of theft, vandalism, or 
trespass. This subdivision does not apply to the release of information for the purpose of 
scholarly research, examination by other public bodies for the protection of the resource or by 
recognized tribes, or the fed eral Native American Graves Protection and Repatriation Act;  
(14)  Records or portions of records kept by public bodies which maintain collections of 
archeological, historical, or paleontological significance which nongovernmental donors have 
requested to remain closed or which reveal the names and addresses of donors of such articles 
of archaeological, historical, or paleontological significance unless the donor approves"
94,,"Trayce Hockstad   
NY CLS STATE TECHNOLOGY LAW § 206  
Current through 2024 released Chapters 1 -59, 61 -117 
 
New York Consolidated Laws Service   >  State Technology Law (Arts. I — 4)  >  Article II Internet Security and 
Privacy Act (§§ 201 — 210) 
 
§ 206. Exceptions   
 
Notwithstanding section two hundred four of this article, a state agency may collect or disclose 
personal  information if the collection or disclosure is:  
1.  necessary to perform the statutory duties of the state agency that collected or is collecting 
the personal information, or necessary for that agency to operate a program authorized by law, 
or authorized by state or federal statute or regulation;  
2.  made pursuant to a court order or by law;  
3.  for the purpose of validating the identity of the user; or  
4.  if the information is used solely for statistical purposes and is in a form that cannot be used 
to identify any particular person.  
History   
 
Formerly § 207, add, L 2001, ch 578, § 1, eff June 17, 2002 (see 2001 note below); amd, L 2002, ch 17, § 
1, eff June 17, 2002.  
 
New York Consolidated Laws Service  
Copyright © 2024 All rights reserved.  
 
 
End of Do cument"
95,,"Page 1 of 1 
NY CLS STATE TECHNOLOGY LAW § 209  
    
NY CLS STATE TECHNOLOGY LAW § 209  
Current through 2024 released Chapters 1 -59, 61 -117 
 
New York Consolidated Laws Service   >  State Technology Law (Arts. I — 4)  >  Article II Internet Security and 
Privacy Act (§§ 201 — 210) 
 
§ 209. Notification of a breach of the security of the system or a breach of network 
security; shared data.   
 
1.  The office shall, within twenty -four hours of either being notified of or receiving evidence of a 
breach of the security of the system, or a breach of network security, as defined in paragraphs (a) 
and (b) of subdivision three of this section, notify the c hief information officer, the chief 
information security officer, and where appropriate, the cyber security coordinator of any state 
entity with which it shares data, provides networked services or shares a network connection 
whose data, services or connec tion is reasonably suspected to be affected by any such breach.  
2.  The office shall provide the chief information officer, the chief information security officer, and 
where appropriate, the cyber risk coordinator of any state entity, who has been notified  pursuant to 
subdivision one of this section, with its plan for remediation of the breach and future protection of 
such data and network.  
3.  For purposes of this section:  
(a)  “Breach of the security of the system” shall have the same meaning as defined i n 
paragraph (b) of subdivision one of section two hundred eight of this article.  
(b)  “Breach of network security” shall mean unauthorized access to or access without valid 
authorization of a computer network which compromises the security, confidentiality , or 
integrity of such network.  
(c)  “State entity” shall have the same meaning as provided by paragraph (c) of subdivision one 
of section two hundred eight of this article.  
History   
 
L 2021, ch 796, § 1, effective December 22, 2021; L 2022, ch 107, § 1, effective December 22, 2021.  
 
New York Consolidated Laws Service  
Copyright © 2024 All rights reserved.  
 
 
End of Document"
96,,"Page 2 of 4 
NY CLS Exec § 709  
   and man -made disasters, subject to any applicable laws, rules, or regulations governing the 
release, disclosure or sharing of any such information;  
(h)  assess the preparedness of state and local public health sys tems to respond to terrorist acts 
and other natural and man -made disasters, including ensuring the availability of early warning 
systems designed to detect potential threats and determining adequacy and availability of 
necessary vaccines and pharmaceutical s and hospital capacity;  
(i)  coordinate strategies, protocols and first -responder equipment needs that may be used to 
monitor, detect, respond to and mitigate the consequences of a potential biological, chemical or 
radiological terrorist act or threat;  
(j)  work with local, state and federal agencies and private entities to conduct assessments of 
the vulnerability of critical infrastructure to terrorist attack, cyber attack, and other natural and 
man-made disasters, including, but not limited to, nuclear f acilities, power plants, 
telecommunications systems, mass transportation systems, public roadways, railways, bridges 
and tunnels, and develop strategies that may be used to protect such infrastructure from 
terrorist attack, cyber attack, and other natural and man -made disasters;  
(k)  develop plans that may be used to promote rapid recovery from terrorist attacks and other 
natural and man -made disasters, to ensure prompt restoration of transportation, utilities, critical 
communications and information system s and to protect such infrastructure;  
(l)  develop plans that may be used to contain and remove hazardous materials used in a 
terrorist attack or released as a result of natural or man -made disaster;  
(m)  act as primary contact with the federal department of homeland security;  
(n)  adopt, promulgate, amend and rescind rules and regulations to effectuate the provisions 
and purposes of this article and the powers and duties of the division in connection therewith;  
(o)  consult with appropriate state and local  governments, institutions of higher learning, first 
responders, health care providers and private entities as necessary to effectuate the provisions 
of this article, and work with those entities to establish, facilitate and foster cooperation to 
better pr epare the state to prevent and respond to threats and acts of terrorism and other natural 
and man -made disasters;  
(p)  to serve as a clearinghouse for the benefit of municipalities regarding information relating 
to available federal, state and regional gra nt programs in connection with homeland security, 
disaster preparedness, communication infrastructure and emergency first responder services, 
and to promulgate rules and regulations necessary to ensure that grant information is timely 
posted on the divisio n’s website;  
(q)  request from any department, division, office, commission or other agency of the state or 
any political subdivision thereof, and the same are authorized to provide, such assistance, 
services and data as may be required by the division of homeland security and emergency 
services in carrying out the purposes of this article, subject to applicable laws, rules, and 
regulations;  
(r)  develop standards and a certification process for training programs for training of private 
security officers in  commercial buildings which shall:  
(i)  improve observation, detection and reporting skills;"
97,,"Trayce Hockstad   
NY CLS STATE TECHNOLOGY LAW § 209  
Current through 2024 released Chapters 1 -59, 61 -117 
 
New York Consolidated Laws Service   >  State Technology Law (Arts. I — 4)  >  Article II Internet Security and 
Privacy Act (§§ 201 — 210) 
 
§ 209. Notification of a breach o f the security of the system or a breach of network 
security; shared data.   
 
1.  The office shall, within twenty -four hours of either being notified of or receiving evidence of a 
breach of the security of the system, or a breach of network security, as defined in paragraphs (a) 
and (b) of subdivision three of this section, notify the chief information officer, the chief 
information security officer, and where appropriate, the cyber security coordinator of any state 
entity with which it shares data, provi des networked services or shares a network connection 
whose data, services or connection is reasonably suspected to be affected by any such breach.  
2.  The office shall provide the chief information officer, the chief information security officer, and 
wher e appropriate, the cyber risk coordinator of any state entity, who has been notified pursuant to 
subdivision one of this section, with its plan for remediation of the breach and future protection of 
such data and network.  
3.  For purposes of this section:  
(a)  “Breach of the security of the system” shall have the same meaning as defined in 
paragraph (b) of subdivision one of section two hundred eight of this article.  
(b)  “Breach of network security” shall mean unauthorized access to or access without valid  
authorization of a computer network which compromises the security, confidentiality, or 
integrity of such network.  
(c)  “State entity” shall have the same meaning as provided by paragraph (c) of subdivision one 
of section two hundred eight of this article . 
History   
 
L 2021, ch 796, § 1, effective December 22, 2021; L 2022, ch 107, § 1, effective December 22, 2021.  
 
New York Consolidated Laws Service  
Copyright © 2024 All rights reserved.  
 
 
End of Document"
98,,"Page 3 of 5 
§ 208. Notification; person without valid authorization has acquired private information  
   (b)  If notice of the breach of the security of the system is made to affected persons pursuant to 
the breach notification requirements under any of the following laws, nothing in this section 
shall require any additional notice to those affected persons, but notice still shall be provided to 
the state attorney general, the department of state and the office of information technology 
services pursuant to paragraph (a) of subdivision seve n of this section and to consumer 
reporting agencies pursuant to paragraph (b) of subdivision seven of this section:  
(i)  regulations promulgated pursuant to Title V of the federal Gramm -Leach -Bliley Act 
(15 U.S.C. 6801 to 6809), as amended from time to ti me; 
(ii)  regulations implementing the Health Insurance Portability and Accountability Act of 
1996 (45 C.F.R. parts 160 and 164), as amended from time to time, and the Health 
Information Technology for Economic and Clinical Health Act, as amended from time  to 
time;  
(iii)  part five hundred of title twenty -three of the official compilation of codes, rules and 
regulations of the state of New York, as amended from time to time; or  
(iv)  any other data security rules and regulations of, and the statutes adminis tered by, any 
official department, division, commission or agency of the federal or New York state 
government as such rules, regulations or statutes are interpreted by such department, 
division, commission or agency or by the federal or New York state cour ts. 
3.  Any state entity that maintains computerized data that includes private information which such 
agency does not own shall notify the owner or licensee of the information of any breach of the 
security of the system immediately following discovery, if  the private information was, or is 
reasonably believed to have been, accessed or acquired by a person without valid authorization.  
4.  The notification required by this section may be delayed if a law enforcement agency 
determines that such notification i mpedes a criminal investigation. The notification required by 
this section shall be made after such law enforcement agency determines that such notification 
does not compromise such investigation.  
5.  The notice required by this section shall be directly p rovided to the affected persons by one of 
the following methods:  
(a)  written notice;  
(b)  electronic notice, provided that the person to whom notice is required has expressly 
consented to receiving said notice in electronic form and a log of each such not ification is kept 
by the state entity who notifies affected persons in such form; provided further, however, that 
in no case shall any person or business require a person to consent to accepting said notice in 
said form as a condition of establishing any b usiness relationship or engaging in any 
transaction;  
(c)  telephone notification provided that a log of each such notification is kept by the state 
entity who notifies affected persons; or  
(d)  Substitute notice, if a state entity demonstrates to the state  attorney general that the cost of 
providing notice would exceed two hundred fifty thousand dollars, or that the affected class of 
subject persons to be notified exceeds five hundred thousand, or such agency does not have 
sufficient contact information. Su bstitute notice shall consist of all of the following:"
99,,"Page 2 of 2 
La. R.S. § 22:2509  
 Trayce Hockstad   (a)  Establishing and maintaining an information security program pursuant to such 
statutes, rules, regulations, procedures, or guidelines established by another jurisdiction.  
(b)  Complying with and submitting a written statement certifying its compliance with the 
information security program established and maintained pursuant to Subpar agraph (a) of 
this Paragraph.  
B.  In the event that a licensee ceases to qualify for an exemption pursuant to Subsection A of this 
Section, the licensee shall have one hundred eighty days to comply with the provisions of this 
Chapter.  
C.  A licensee that i s subject to R.S. 51:3076 shall be exempt from the provisions of R.S. 22:2506 
if the licensee does all of the following:  
(1)  Notifies affected consumers of cybersecurity events relating to the licensee’s insurance 
business in a manner consistent with the requirements of the Gramm -Leach -Bliley Act.  
(2)  Notifies the commissioner of cybersecurity events relating to the licensee’s insurance 
business in a manner consistent with and at the same time as the notice the licensee gives to 
federal regulatory authori ties. 
History   
 
Acts 2020, No. 283, § 1, effective August 1, 2020.  
 
LexisNexis® Louisiana Annotated Statutes  
Copyright © 2024 All rights reserved.  
 
 
End of Document"
100,,"Page 2 of 4 
La. R.S. § 22:2506  
 Trayce Hockstad   (a)  Date of the cybersecurity event.  
(b)  Description of how the information was exposed, lost, stolen, or breached, including 
the specific roles and responsibilities of any third -party service providers.  
(c)  How the cybersecurity event was discov ered.  
(d)  Whether any lost, stolen, or breached information has been recovered and, if so, how 
reocvery was accomplished.  
(e)  The identity of the source of the cybersecurity event.  
(f)  Whether the licensee has filed a police report or has notified any r egulatory, 
government, or law enforcement agencies and when the notification was provided.  
(g)   
(i)  Description of the specific types of information acquired without authorization.  
(ii)  For the purposes of this Subparagraph, “specific types of information” means 
particular data elements including but not limited to types of medical information, 
types of financial information, or types of information allowing identification of the 
consumer.  
(h)  The period during which the cybersecurity event com promised the information system.  
(i)   
(i)  The total number of consumers in this state affected by the cybersecurity event.  
(ii)  The licensee shall provide the best estimate in the initial report to the 
commissioner and update this estimate with each sub sequent report to the 
commissioner pursuant to this Section.  
(j)  The results of any internal review identifying a lapse in either automated controls or 
internal procedures, or confirming that all automated controls or internal procedures were 
followed.  
(k)  Description of efforts being undertaken to remediate the situation which permitted the 
cybersecurity event to occur.  
(l)  A copy of the licensee’s privacy policy and a statement outlining the steps the licensee 
will take to investigate and notify consum ers affected by the cybersecurity event.  
(m)  Name of a contact person who is both familiar with the cybersecurity event and 
authorized to act for the licensee.  
C.  A licensee shall comply with the Database Security Breach Notification Law, R.S. 51:3071 et  
seq., as applicable, and shall provide to the commissioner a copy of the notice sent to consumers if 
the licensee is required to notify the commissioner pursuant to Subsection A of this Section.  
D.   
(1)  In the case of a cybersecurity event in a system m aintained by a third -party service 
provider of which the licensee has become aware, all of the following shall apply:"
101,,"Page 3 of 4 
La. R.S. § 22:2504  
 Trayce Hockstad   (h)  Regularly test and monitor systems and procedures to detect actual and attempted 
attacks on or intrusions into information systems.  
(i)  Include audit trails within the information security program designed to detect and 
respond to cybersecurity events and designed to reconstruct material financial transactions 
sufficient to support normal operations and obligations of the licensee.  
(j)  Implement measures to protect against destruction, loss, or damage of nonpublic 
information due to environmental hazards, such as fire and water damage or other 
catastrophes or technological failures.  
(k)  Develop, implement, and maintain procedures for the secure disposal of nonpublic 
information in any format.  
(3)  Include cybersecurity risks in the licensee’s enterprise risk management process.  
(4)  Stay informed regarding emerging threats or vulnerabilities.  
(5)  Use reasonable security measures when shar ing information relative to the character of the 
sharing and the type of information shared.  
(6)  Provide its personnel with cybersecurity awareness training that reflects current risks 
identified by the licensee in the risk assessment.  
E.  If a licensee h as a board of directors, the board or an appropriate committee of the board shall, 
at a minimum, require a licensee’s executive management or its delegates to do all of the 
following:  
(1)  Develop, implement, and maintain the licensee’s information securit y program.  
(2)  Report in writing, at least annually, all of the following information:  
(a)  The overall status of the information security program and the licensee’s compliance 
with this Chapter.  
(b)  Material matters related to the information security p rogram, addressing issues such as 
risk assessment, risk management and control decisions, third -party service provider 
arrangements, results of testing, cybersecurity events or violations and management’s 
responses thereto, and recommendations for changes in the information security program.  
(3)  If executive management delegates any of the responsibilities provided for in this Section, 
management shall oversee the development, implementation, and maintenance of the 
licensee’s information security program p repared by the delegates and shall receive a report 
from the delegates complying with the requirements of the report to the board of directors 
above.  
F.  With regard to third -party service providers, a licensee shall do all of the following:  
(1)  Exercise due diligence in selecting a third -party service provider.  
(2)  Require third -party service providers to implement appropriate administrative, technical, 
and physical measures to protect and secure the information systems and nonpublic 
information that are  accessible to or held by the third -party service provider.  
G.  A licensee shall monitor, evaluate, and adjust, as appropriate, the information security program 
consistent with any relevant changes in technology, the sensitivity of its nonpublic informatio n,"
