,question,chunks
43,,"Page 3 of 4 
MCLS § 500.555  
 Trayce Hockstad   (x)  Including audit trails within the information security program designed to detect and 
respond to cybersecurity events and designed to reconstruct material financial transactions 
sufficient to support normal operations and obligations of the licensee.  
(xi)  Implementing measures to protect against destruction, loss, or damage of nonpublic 
information due to environmental hazards, such as fire and water damage or other 
catastrophes or technological failures.  
(xii)  Developing, implementing, and maintaini ng procedures for the secure disposal of 
nonpublic information in any format.  
(c)  Include cybersecurity risks in the licensee’s enterprise risk management process.  
(d)  Stay informed regarding emerging threats or vulnerabilities and utilize reasonable security 
measures when sharing information relative to the character of the sharing and the type of 
information shared.  
(e)  Provide its personnel with cybersecurity awareness training that is updated as necessary to 
reflect risks identified by the license e in the risk assessment.  
(5)  If a licensee has a board of directors, the board or an appropriate committee of the board shall, 
at a minimum, do all of the following:  
(a)  Require the licensee’s executive management or its delegates to develop, implement,  and 
maintain the licensee’s information security program.  
(b)  Require the licensee’s executive management or its delegates to report in writing, at least 
annually, all of the following information:  
(i)  The overall status of the information security prog ram and the licensee’s compliance 
with this chapter.  
(ii)  Material matters related to the information security program, addressing issues such as 
risk assessment, risk management and control decisions, results of testing, cybersecurity 
events or violation s, and management’s responses to the material matters described in this 
subparagraph, and recommendations for changes in the information security program.  
(iii)  If executive management delegates any of its responsibilities under this section, it 
shall ove rsee the development, implementation, and maintenance of the licensee’s 
information security program prepared by a delegate and shall receive a report from the 
delegate complying with the requirements of the report to the board of directors.  
(6)  A license e shall exercise due diligence in selecting its third -party service provider. A licensee 
shall require a third -party service provider to implement appropriate administrative, technical, and 
physical measures to protect and secure the information systems an d nonpublic information that 
are accessible to, or held by, the third -party service provider.  
(7)  A licensee shall monitor, evaluate, and adjust, as appropriate, the information security 
program consistent with any relevant changes in technology, the sens itivity of its nonpublic 
information, internal or external threats to information, and the licensee’s own changing business 
arrangements, such as mergers and acquisitions, alliances and joint ventures, outsourcing 
arrangements, and changes to information s ystems."
44,,"Page 3 of 5 
MCLS § 500.561  
 Trayce Hockstad   (a)  For a notice provided under subsection (5)(a) or (b), be written in a clear and conspicuous 
manner and contain the content required under subdivisions (c) to (g).  
(b)  For a notice provided under subsectio n (5)(c), clearly communicate the content required 
under subdivisions (c) to (g) to the recipient of the telephone call.  
(c)  Describe the cybersecurity event in general terms.  
(d)  Describe the type of personal information that is the subject of the unaut horized access or 
use. 
(e)  If applicable, generally describe what the licensee providing the notice has done to protect 
data from further security breaches.  
(f)  Include a telephone number where a notice recipient may obtain assistance or additional 
infor mation.  
(g)  Remind notice recipients of the need to remain vigilant for incidents of fraud and identity 
theft.  
(7)  A licensee may provide any notice required under this section under an agreement between the 
licensee and another licensee, if the notice p rovided under the agreement does not conflict with 
this section.  
(8)  Except as provided in this subsection, after a licensee provides a notice under this section, the 
licensee shall notify each consumer reporting agency that compiles and maintains files o n 
consumers on a nationwide basis, as defined in 15 USC 1681a(p), of the cybersecurity event 
without unreasonable delay. A notification under this subsection must include the number of 
notices that the licensee provided to residents of this state and the t iming of those notices. This 
subsection does not apply if either of the following is met:  
(a)  The licensee is required under this section to provide notice of a cybersecurity event to 
1,000 or fewer residents of this state.  
(b)  The licensee is subject to  15 USC 6801 to 6809.  
(9)  A licensee that is subject to and complies with the health insurance portability and 
accountability act of 1996, Public Law 104 -191, and with regulations promulgated under that act, 
45 CFR parts 160 and 164, for the prevention of  unauthorized access to customer information and 
customer notice is considered to be in compliance with this section.  
(10)  A person that provides notice of a cybersecurity event in the manner described in this section 
when a cybersecurity event has not oc curred, with the intent to defraud, is guilty of a misdemeanor 
punishable as follows:  
(a)  Except as otherwise provided under subdivisions (b) and (c), by imprisonment for not 
more than 93 days or a fine of not more than $250.00 for each violation, or both . 
(b)  For a second violation, by imprisonment for not more than 93 days or a fine of not more 
than $500.00 for each violation, or both.  
(c)  For a third or subsequent violation, by imprisonment for not more than 93 days or a fine of 
not more than $750.00 for each violation, or both."
45,,"Page 4 of 5 
MCLS § 500.561  
 Trayce Hockstad   (11)  Subject to subsection (12), a person that knowingly fails to provide a notice of a 
cybersecurity event required under this section may be ordered to pay a civil fine of not more than 
$250.00 for each failure to provide no tice. The attorney general or a prosecuting attorney may 
bring an action to recover a civil fine under this section.  
(12)  The aggregate liability of a person for civil fines under subsection (11) for multiple violations 
of subsection (11) that arise from the same cybersecurity event must not exceed $750,000.00.  
(13)  Subsections (10) and (11) do not affect the availability of any civil remedy for a violation of 
state or federal law.  
(14)  This section applies to the discovery or notification of a breach of  the security of a database 
that occurs after December 31, 2019.  
(15)  This section does not apply to the access or acquisition by a person or agency of federal, 
state, or local government records or documents lawfully made available to the general public.  
(16)  This section deals with subject matter that is of statewide concern, and any charter, 
ordinance, resolution, regulation, rule, or other action by a municipal corporation or other political 
subdivision of this state to regulate, directly or indirectl y, any matter expressly set forth in this 
section is preempted.  
(17)  As used in this section:  
(a)  “Data” means computerized information.  
(b)  “Identity theft” means a person doing any of the following:  
(i)  With intent to defraud or violate the law, using or attempting to use the personal 
information of another person to do either of the following:  
(A)  Obtain credit, goods, services, money, property, a vital record, a confidential 
telephone record, medical records or information, or employment.  
(B)  Commit another unlawful act.  
(ii)  By concealing, withholding, or misrepresenting the person’s identity, using or 
attempting to use the personal information of another person to do either of the following:  
(A)  Obtain credit, goods, services, money, proper ty, a vital record, a confidential 
telephone record, medical records or information, or employment.  
(B)  Commit another unlawful act.  
(c)  “Personal information” means the first name or first initial and last name linked to 1 or 
more of the following data elements of a resident of this state:  
(i)  A Social Security number.  
(ii)  A driver license number or state personal identification card number.  
(iii)  A demand deposit or other financial account number, or credit card or debit card 
number, in combination with any required security code, access code, or password that 
would permit access to any of the resident’s financial accounts.  
History"
46,,"Page 2 of 2 
MCLS § 18.230  
 Trayce Hockstad   (5)  The department may provide compensation for actual and necessary travel and subsistence 
expenses incurred by Michigan cyber civilian corps volunteers on a deployment at the discr etion 
of the department.  
(6)  The department may establish a fee schedule for clients that wish to use the assistance of the 
Michigan cyber civilian corps. The department may recoup expenses through the fees but may not 
generate a profit.  
(7)  Information voluntarily given to the Michigan cyber command center or obtained under this 
act that would identify or provide a means of identifying a person that may, as a result of 
disclosure of the information, become a victim of a cybersecurity incident or that wou ld disclose a 
person’s cybersecurity plans or cybersecurity -related practices, procedures, methods, results, 
organizational information system infrastructure, hardware, or software is exempt from disclosure 
under the freedom of information act, 1976 PA 442 , MCL 15.231 to 15.246.  
History   
 
Pub Acts 2017, No. 132, effective January 24, 2018; Pub Acts 2020, No. 289, effective March 24, 2021.  
 
Michigan Compiled Laws Service  
Copyright © 2024 All rights reserved.  
 
 
End of Document"
47,,"Page 4 of 6 
MCLS § 15.243  
 Trayce Hockstad   (x)  Identify or provide a means of identifying residences that law enforcement agencies 
are requested to check in the absence of their owners or tenants.  
(t)  Except as otherwise provided in this su bdivision, records and information pertaining to an 
investigation or a compliance conference conducted by the department under article 15 of the 
public health code, 1978 PA 368, MCL 333.16101 to 333.18838, before a complaint is issued. 
This subdivision doe s not apply to records or information pertaining to 1 or more of the 
following:  
(i)  The fact that an allegation has been received and an investigation is being conducted, 
and the date the allegation was received.  
(ii)  The fact that an allegation was rece ived by the department; the fact that the department 
did not issue a complaint for the allegation; and the fact that the allegation was dismissed.  
(u)  Records of a public body’s security measures, including security plans, security codes and 
combinations,  passwords, passes, keys, and security procedures, to the extent that the records 
relate to the ongoing security of the public body.  
(v)  Records or information relating to a civil action in which the requesting party and the 
public body are parties.  
(w)  Information or records that would disclose the Social Security number of an individual.  
(x)  Except as otherwise provided in this subdivision, an application for the position of 
president of an institution of higher education established under section 4, 5 , or 6 of article 
VIII of the state constitution of 1963, materials submitted with such an application, letters of 
recommendation or references concerning an applicant, and records or information relating to 
the process of searching for and selecting an in dividual for a position described in this 
subdivision, if the records or information could be used to identify a candidate for the position. 
However, after 1 or more individuals have been identified as finalists for a position described 
in this subdivision , this subdivision does not apply to a public record described in this 
subdivision, except a letter of recommendation or reference, to the extent that the public record 
relates to an individual identified as a finalist for the position.  
(y)  Records or inf ormation of measures designed to protect the security or safety of persons or 
property, or the confidentiality, integrity, or availability of information systems, whether 
public or private, including, but not limited to, building, public works, and public water supply 
designs to the extent that those designs relate to the ongoing security measures of a public 
body, capabilities and plans for responding to a violation of the Michigan anti -terrorism act, 
chapter LXXXIII -A of the Michigan penal code, 1931 PA 3 28, MCL 750.543a to 750.543z, 
emergency response plans, risk planning documents, threat assessments, domestic 
preparedness strategies, and cybersecurity plans, assessments, or vulnerabilities, unless 
disclosure would not impair a public body’s ability to p rotect the security or safety of persons 
or property or unless the public interest in disclosure outweighs the public interest in 
nondisclosure in the particular instance.  
(z)  Information that would identify or provide a means of identifying a person that  may, as a 
result of disclosure of the information, become a victim of a cybersecurity incident or that 
would disclose a person’s cybersecurity plans or cybersecurity -related practices, procedures, 
methods, results, organizational information system infras tructure, hardware, or software."
48,,"Page 2 of 4 
18 Del. C. § 8606  
   (2)  A licensee shall provide as much of the following information as possible:  
a.  Date of the cybersecurity event.  
b.  Description of how the information was exposed, lost, stolen, or breached, including the 
specific role and responsibility of a third -party  service provider, if any.  
c.  How the cybersecurity event was discovered.  
d.  Whether any lost, stolen, or breached information has been recovered and, if so, how it 
was lost, stolen, or breached.  
e.  The identity of the source of the cybersecurity event.  
f.  Whether the licensee has filed a police report or notified a regulatory, government, or 
law-enforcement agency and, if so, when the notification was provided.  
g.  Description of the specific types of information acquired without authorization. For the  
purposes of this paragraph (b)(2)g., “specific types of information” means particular data 
elements, including medical information, financial information, or information allowing 
identification of a consumer.  
h.  The period during which the cybersecurity event compromised the information system.  
i.  The number of total consumers in this State who are affected by the cybersecurity event. 
The licensee shall provide the best estimate in the initial report to the Commissioner and 
update the estimate with each subsequent report to the Commissioner under this section.  
j.  The results of an internal review identifying a lapse in either automated controls or 
internal procedures, or confirming that the automated controls or internal procedures were 
followed.  
k.  Description of efforts being undertaken to remediate the situation which permitted the 
cybersecurity event to occur.  
 l.   A copy of the licensee’s privacy policy and a statement outlining the steps the licensee 
will take to investigate and notify a consumer affected by a cybersecurity event.  
m.  The name of a contact person who is both familiar with the cybersecurity event and 
authorized to act for the licensee.  
(c) Notification to consumers. —   If a licensee determines that a cybersecurity event that has a 
reasonable likelihood of materially harming a consumer has occurred and the event is 1 for which 
the licensee is required under subsection (a) of this section to notify the Commissioner, the 
licensee shall provide notice of the event to each affected consu mer and provide a copy of the 
notice to the Commissioner.  
(1)  A licensee must provide notice under this subsection (c) of this section without 
unreasonable delay but no later than 60 days after determining that a cybersecurity event 
occurred, unless any o f the following apply:  
a.  Federal law requires a shorter time period.  
b.  A law -enforcement agency determines that the notice will impede a criminal 
investigation and the law -enforcement agency has requested that the licensee delay notice."
49,,"Page 5 of 5 
18 Del. C. § 8604  
   e.  Identification of requirements for the remediation of any identified weaknesses in an 
information system and associated controls.  
f.  Documentation and reporting regarding cybersecurity events and related incident 
response activities.  
g.  As necessary, the evaluation and revision of the incident response plan following a 
cybersecurity event.  
(i) Annual certification to the Commissioner of domiciliary state. —   An insurer do miciled in 
this State shall do all of the following:  
(1)  Submit annually to the Commissioner a written statement by February 15, certifying that 
the insurer is in compliance with the requirements under in this section.  
(2)  Maintain for the Department’s examination all records, schedules, and data supporting a 
certificate under this subsection for a period of 5 years.  
(3)  To the extent an insurer has identified an area, system, or process that requires material 
improvement, updating, or redesign, documen t the identification and the remedial effort 
planned and underway to address the identified area, system, or process. Documentation under 
this paragraph (i)(3) must be available for the Commissioner’s inspection.  
History   
 
82 Del. Laws, c. 176, § 1.  
 
Delaware Code Annotated  
Copyright © 2024 All rights reserved.  
 
 
End of Document"
50,,"Page 4 of 5 
18 Del. C. § 8604  
   4.  Cybersecurity events or violations and management’ s responses to the events.  
5.  Recommendations for changes in the information security program.  
(3)  If executive management delegates any of its responsibilities under this section, all of the 
following must occur:  
a.  Executive management shall oversee t he development, implementation, and 
maintenance of the licensee’s information security program that the delegate prepares.  
b.  The delegate shall submit to executive management a report that complies with the 
requirements of the report to the board of dire ctors under paragraph (e)(2) of this section.  
(f) Oversight of third -party service provider arrangements. —    
(1)  A licensee shall exercise due diligence in selecting a third -party service provider.  
(2)  A licensee shall require a third -party service pro vider to implement appropriate 
administrative, technical, and physical measures to protect and secure the information system 
and nonpublic information that the third -party service provider has access to or holds. The 
third -party service provider is not con sidered to have access to or hold encrypted nonpublic 
information for purposes of this section if the associated protective process or key necessary to 
assign meaning to the nonpublic information is not within the third -party service provider’s 
possession.   
(g) Program adjustments. —   A licensee shall monitor, evaluate, and adjust as appropriate the 
information security program consistent with all of the following:  
(1)  Relevant changes in technology.  
(2)  The sensitivity of the licensee’s nonpublic inform ation.  
(3)  Internal or external threats to information.  
(4)  The licensee’s own changing business arrangements, such as mergers and acquisitions, 
alliances and joint ventures, outsourcing arrangements, and changes to information systems.  
(h) Incident resp onse plan. —    
(1)  As part of a licensee’s information security program, the licensee shall establish a written 
incident response plan designed to promptly respond to, and recover from, a cybersecurity 
event that compromises the confidentiality, integrit y, or availability of any of the following:  
a.  Nonpublic information in the licensee’s possession.  
b.  The licensee’s information system.  
c.  The continuing functionality of any aspect of the licensee’s business or operations.  
(2)  An incident response plan under this section must address all of the following areas:  
a.  The internal process for responding to a cybersecurity event.  
b.  The goals of the incident response plan.  
c.  The definition of clear roles, responsibilities, and levels of decision -maki ng authority.  
d.  External and internal communications and information sharing."
51,,"Page 1 of 2 
18 Del. C. § 8605  
    
18 Del. C. § 8605  
This document is current through 84 Del. Laws, c. 254.  
 
Delaware Code Annotated   >  Title 18 Insurance Code (Pts. I — II)  >  Part II Miscellaneous (Chs. 77 — 88)  >  
Chapter 86 Insurance Data Security Act (§§ 8601 — 8611)  
 
§ 8605. Investigation of a cybersecurity event.   
 
(a)  If a licensee learns that a cybersecurity  event has or may have occurred, the licensee, or an 
outside vendor or service provider designated to act on behalf of the licensee, shall conduct a 
prompt investigation.  
(b)  During an investigation under this section, the licensee, or an outside vendor o r service 
provider designated to act on behalf of the licensee, shall, at a minimum, do as much of the 
following as possible:  
(1)  Determine whether a cybersecurity event has occurred.  
(2)  Assess the nature and scope of the cybersecurity event.  
(3)  Ident ify the nonpublic information that may have been involved in the cybersecurity event.  
(4)  Perform or oversee reasonable measures to restore the security of the information system 
compromised in the cybersecurity  event to prevent further unauthorized acquisition, release, or 
use of nonpublic information that is in the licensee’s possession, custody, or control.  
(c)  If a licensee provides nonpublic information to a third -party service provider and learns that a 
cybersecurity event has or may have occurred in a system that the third -party service provider 
maintains, the licensee shall complete the steps listed in subsection (b) of this section or make 
reasonable efforts to confirm and document that the third -party s ervice provider has completed the 
steps.  
(d)  A licensee shall maintain records concerning a cybersecurity event for a period of at least 5 
years from the date of the cybersecurity event and shall produce those records upon the 
Commissioner’s demand.  
Histo ry  
 
82 Del. Laws, c. 176, § 1.  
 
Delaware Code Annotated  
Copyright © 2024 All rights reserved."
52,,"Page 3 of 5 
18 Del. C. § 8604  
   2.  Procedures for evaluating, assessing, or testing the security of an application that a 
licensee uses and was developed externally.  
f.  Modify the information system in accordance with the licensee’s informa tion security 
program.  
g.  Utilize effective controls, which may include multi -factor authentication procedures for 
employees or authorized individuals accessing nonpublic information.  
h.  Regularly test and monitor systems and procedures to detect actual and attempted 
attacks on, or intrusions, into an information system.  
i.  Include audit controls within the information security program designed to do both of 
the following:  
1.  Detect and respond to a cybersecurity event.  
2.  Reconstruct material financial transactions sufficient to support the licensee’s 
normal operations and obligations.  
j.  Implement measures to protect against the destruction, loss, or damage of nonpublic 
information due to environmental hazards, such as fire and water damage, other 
catastrophes, or technological failures.  
k.  Develop, implement, and maintain procedures for the secure disposal of nonpublic 
information in any format.  
(3)  Include cybersecurity risks in the licensee’s enterprise risk management process.  
(4)  Stay informed regarding emerging threats or vulnerabilities and utilize reasonable security 
measures when sharing information relative to the character of the sharing and the type of 
information shared.  
(5)  Provide the licensee’s personnel with cybersecurity awareness training that is updated as 
necessary to reflect risks that the licensee identified in the licensee’s risk assessment under this 
section.  
(e) Oversight by board of directors. —   If a licensee has a board of directors, the board or an 
appropriate  committee of the board shall, at a minimum, do all of the following:  
(1)  Require the licensee’s executive management or its delegates to develop, implement, and 
maintain the licensee’s information security program.  
(2)  Require the licensee’s executive management or its delegates to report in writing at least 
annually all of the following information:  
a.  The overall status of the information security program and the licensee’s compliance 
with this chapter.  
b.  Material matters related to the information  security program, including addressing 
issues such as the following:  
1.  Risk assessment, risk management, and control decisions.  
2.  Third -party service provider arrangements.  
3.  Results of testing."
